{
	"id": "myDevice-noiseLevel-15440",
	"type": "DeviceDataModel",
	"category": "sensor",
	"name": "Name of canal",
	"description": "Description du canal ou voie",
	"location": {
		"type": "Point",
		"coordinates": [
			7.1552125224843621,
			43.660530261510573
		]
	},
	"measurementTechnique": "LDEN",
	"label": "Lden",
	"unitCode": "usedUniversalCode",
	"unitText": "TextOfusedUniversalCode",
	"value": 7587,
	"dateObserved": "2017-10-31T06:00:00",
	"dateLastCalibration": "2017-10-31T06:00:00",
	"height": null,
	"channelState": "db_leqg",
	"multiplier": null,
	"measureFrequency": null,
	"maxValue": null,
	"minValue": null,
	"siteGap": null,
	"elevation": null
}